Carl,https://noriel.ro/media/catalog/product/cache/ed9f5ebe2a117625f6cd6336daddd764/j/u/jucarie-de-plus-minions-despicable-me-carl-23-cm.jpg,0,"29.99 RON","Ba-na-na! Minionii au acaparat cinematografele si au reusit sa aduca zambete largi pe chipul celor mici, dar si al celor mari. Minionii aduc un plus de veselie in viata fiecaruia.
Cei mici se vor indragosti de jucaria de plus Despicable Me - Carl. Rasfat pufos pentru toata lumea!",Noriel,Plus
" Phlat Ball Junior Neon FX",https://noriel.ro/media/catalog/product/cache/ed9f5ebe2a117625f6cd6336daddd764/p/h/phlat-ball-junior-neon-fx_2.jpg,0,"9.99 RON","Distractie in aer liber! Arunci mingea, se transforma intr-un disc, pentru ca mai apoi, cand te astepti mai putin, ai din nou in mana un obiect rotund..",Noriel,"Jocuri de Societate"
Mel,https://noriel.ro/media/catalog/product/cache/ed9f5ebe2a117625f6cd6336daddd764/j/u/jucarie-de-plus-minions-despicable-me-mel-23-cm.jpg,0,"29.99 RON","Ba-na-na! Minionii au acaparat cinematografele si au reusit sa aduca zambete largi pe chipul celor mici, dar si al celor mari. Minionii aduc un plus de veselie in viata fiecaruia.
Cei mici se vor indragosti de jucaria de plus Despicable Me - Mel. Rasfat pufos pentru toata lumea!",Noriel,Plus
Stuart,https://noriel.ro/media/catalog/product/cache/ed9f5ebe2a117625f6cd6336daddd764/j/u/jucarie-de-plus-minions-despicable-me-stuart-23-cm.jpg,0,"29.99 RON","Ba-na-na! Minionii au acaparat cinematografele si au reusit sa aduca zambete largi pe chipul celor mici, dar si al celor mari. Minionii aduc un plus de veselie in viata fiecaruia.
Cei mici se vor indragosti de jucaria de plus Despicable Me - Stuart. Rasfat pufos pentru toata lumea!",Noriel,Plus
"LEGO® DUPLO® - Petrecerea lui Belle",https://noriel.ro/media/catalog/product/cache/ed9f5ebe2a117625f6cd6336daddd764/l/g/lg10877_-_lego_duplo_princess_petrecerea_lui_belle_1.jpg,0,"69.99 RON","Intra in bucataria castelului fermecat pentru a canta si dansa cu Belle de la Disney si noii ei prieteni. Fanii Frumoasei si bestiei de la Disney vor adora sa joace pe roluri scene din film sau sa creeze propriile lor povesti. Dezvolta abilitatile de constructor incepator cu aceasta jucarie Disney LEGO® DUPLO® usor de construit, plina de personaje mult iubite si de caramizi decorate ce dau viata magiei.",Noriel,LEGO
"LEGO® DUPLO® - Camion si excavator pe senile",https://noriel.ro/media/catalog/product/cache/ed9f5ebe2a117625f6cd6336daddd764/l/e/lego-duplo-camion-si-excavator-pe-senile-10812_5.jpg,0,"92.99 RON","Micii sapatori vor adora sa manevreze aceste masini de lucrari usor de construit. Deplaseaza Excavatorul pe sine pe teren neregulat si excaveaza cu cupa sa mare. Demonteaza bratul sau flexibil si functional pentru a-l scurta, apoi incarca Camionul cu functia de basculare pentru a cara molozul!  Setul contine doua figurine",Noriel,LEGO
"LEGO® DUPLO® - Primele animalute",https://noriel.ro/media/catalog/product/cache/ed9f5ebe2a117625f6cd6336daddd764/l/g/lg10858_001_-_lego_duplo_-_primele_animalute_10858__1.jpg,0,"51.99 RON","Ajuta-ti copilul sa construiasca puzzle-uri colorate 3D din caramizi robuste LEGO® DUPLO®. Prescolarii vor adora sa sorteze caramizile in 3 culori diferite, si sa vada ce animal pot construi cu fiecare culoare. Foloseste caramizile decorate pentru a incepe povesti si pentru a le dezvolta limbajul in timp ce invata ce-i place sa manance fiecarui animal. Caramizile DUPLO sunt concepute special pentru a fi distractive si sigure pentru manutele mici.",Noriel,LEGO
"LEGO® DUPLO® - Petrecerea lui Minnie",https://noriel.ro/media/catalog/product/cache/ed9f5ebe2a117625f6cd6336daddd764/1/0/10873_lego_duplo_-_petrecerea_lui_minnie_3_.jpg,0,"102.99 RON","Da o petrecere de zi de nastere pe care Minnie Mouse Disney sa nu o uite!  Micii fani Disney vor adora sa o ajute pe Minnie Mouse sa sarbatoreasca in stil mare cu 10873 Petrecerea lui Minnie LEGO® DUPLO®! Joaca-te cu ei conducand-o pe Minnie in simpatica ei masina roz la locul petrecerii, unde pisica Figaro asteapta sa inceapa petrecerea. Acest set LEGO DUPLO este perfect pentru joaca pe roluri nesfarsita cu tematica de serbare a zilei de nastere, si vine cu un gigantic tort construibil plus 2 caramizi decorate reprezentand cadouri. Include o figurina LEGO DUPLO: Minnie Mouse plus o figurina pisica.",Noriel,LEGO
"LEGO® Ninjago - Dragonjitzu auriu ",https://noriel.ro/media/catalog/product/cache/ed9f5ebe2a117625f6cd6336daddd764/l/e/lego_ninjago_-_dragonjitzu_auriu_70644_01.jpg,0,"44.99 RON","Incepe-ti antrenamentul construind manerul din caramizi LEGO®. Apoi aseaza-l pe Maestrul Auriu in capsula, ataseaza lama si aripile de dragon, si trage snurul de lansare. Poti face cascadorii aeriene extraordinare precum Saltul dragonului, si intrece-te cu prietenii tai in provocari precum Vanatorul de dragoni.",Noriel,LEGO
"LEGO® Friends - Dormitorul Miei",https://noriel.ro/media/catalog/product/cache/ed9f5ebe2a117625f6cd6336daddd764/l/g/lg41327_001_-_lego_friends_-_dormitorul_miei_41327__1.jpg,0,"34.99 RON","Urca-te in patul casutei din copac a Miei si ajut-o sa-si foloseasca statia de emisie-receptie pentru a-i invita pe prietenii in vizita. Sari pe skateboard si exerseaza-ti abilitatile pe rampa. Distreaza-te cu iepurasul sau Twister, si asigura-te ca are destula hrana inainte de a lua skateboard-ul sau vasla si de a pleca cu Mia in aventuri in aer liber.",Noriel,LEGO
"Blaster Nerf N-Strike Surgefire",https://noriel.ro/media/catalog/product/cache/ed9f5ebe2a117625f6cd6336daddd764/b/l/blaster_nerf_n-strike_surgefire_2_.jpg,0,"124.99 RON","Distruge-ti concurenta cu o rafala de 15 proiectile din blasterul NERF SurgeFire!  Acest blaster N-Strike Elite are un tambur rotativ cu 15 proiectile.  Alege o tinta si trage cate un proiectil pe rand, sau lanseaza toate cele 15 proiectile intr-o rafala rapida.  Acest blaster lanseaza proiectilele la o distanta de pana la 27 de metri, asa ca poti sa intri in actiune si sa preiei controlul! Include 15 proiectile Elite.",Noriel,"Jocuri de Societate"
"Set baloane pentru apa cu tobogan",https://noriel.ro/media/catalog/product/cache/ed9f5ebe2a117625f6cd6336daddd764/s/e/set_baloane_pentru_apa_cu_tobogan_100_buc_5697_copy_1.jpg,0,"103.99 RON","Umpleti 100 de baloane in mai putin de 60 secunde. Poti umple baloanele fara a te mai uda cu mufa conectoare direct la furtunul de acasa. Conecteaza si umple !",Noriel,"Jocuri de Societate"
" Set 100 de mingi, Dede, 7 cm",https://noriel.ro/media/catalog/product/cache/ed9f5ebe2a117625f6cd6336daddd764/s/e/set-mingi-7-cm-100-buc_1.jpg,0,"99.99 RON",,Noriel,"Jocuri de Societate"
"Casuta copii Little Tikes Prima mea casuta",https://noriel.ro/media/catalog/product/cache/ed9f5ebe2a117625f6cd6336daddd764/c/a/casuta-copii-little-tikes-prima-mea-casuta-albastru_1.jpg,0,"829.99 RON","Cine nu isi aminteste de prima lui casa? Confortul, faptul ca te puteai gandi in liniste la orice lucru, distractia cu prietenii. Acum, cel mic poate avea toate acestea cu un efort minim financiar. Fara rate, fara acte, fara cozi. Prima casuta de copii poate veni direct in gradina (va fi, astfel, si aproape de parinti). Cu un acoperis interesant si stabil, cu o usa amuzanta, sigur va fi pe placul oricarui copil. Distractia va fi garantata! Jocurile vor arata altfel cu casuta pentru copii de la Little Tikes! Cheama-i prietenii si spuneti start distractiei!",Noriel,"Jocuri de Societate"
" Coarda de sarit Disney Princess",https://noriel.ro/media/catalog/product/cache/ed9f5ebe2a117625f6cd6336daddd764/c/o/coarda-de-sarit-disney-princess.jpg,0,"8.99 RON","Coarda de sarit reprezinta o achizitie pe care parintii o fac din ce in ce mai rar, asta desi, atunci cand erau mici, obisnuiau sa sara coarda in fata casei intreaga zi si sa creeze o multime de jocuri si de sarituri care mai de care mai ciudate.  Sa faci sport atunci cand esti mic e important. Si poate fi distractiv intreg procesul, mai ales in sezonul primavara-vara. Finding Dory o poate insoti pe cea mica in timpul activitatilor in aer liber.Fetitele cu stil fac sport si sunt cool!",Noriel,"Jocuri de Societate"
"Trenulet Thomas & Friends Adventures, Diesel, DJT31",https://noriel.ro/media/catalog/product/cache/ed9f5ebe2a117625f6cd6336daddd764/t/r/trenulet_thomas_friends_adventures_diesel_djt31_4_.jpg,0,"9.99 RON","Personaje Thomas & Friends Adventures.  Locomotivele si vagoanele din seria Thomas and Friends – Adventures, sunt compatibile cu sinele si seturile din seriile anterioare Take N Play si Take Along (au acelasi ecartament), dar nu se pot cupla cu locomotivele si vagoanele din seriile anterioare datorita sistemului diferit de prindere. ",Noriel,Masinute
"Masinuta Hot Wheels Monster Jam, Rev Tredz, Black Ops, FMB43",https://noriel.ro/media/catalog/product/cache/ed9f5ebe2a117625f6cd6336daddd764/m/a/masinuta_hot_wheels_monster_jam_rev_tredz_black_ops_fmb43_3_.jpg,0,"69.99 RON","Zdrobeste concurenta cu Masinuta Hot Wheels Monster Truck Rev Tredz, Black Ops, FMB43 Acest monstru cu motor puternic si roti feroce este de neoprit la fel ca cei mari de pe circuitul Monster Jam. Niciun obstacol nu ii sta in cale!",Noriel,Masinute
" Masinuta Maisto Pontiac GTO, Hurst Edition, 1:18",https://noriel.ro/media/catalog/product/cache/ed9f5ebe2a117625f6cd6336daddd764/m/a/masinuta-maisto-pontiac-gto-hurst-edition-118.jpg,0,"127.99 RON","Maisto Pontiac GTO, Hurst Edition, are carcasa metalica cu detalii din plastic. Este replicata scalata a modelului de masina original.",Noriel,Masinute
"Masinuta Maisto Nissan GT-R 1:24",https://noriel.ro/media/catalog/product/cache/ed9f5ebe2a117625f6cd6336daddd764/m/a/masinuta-maisto-nissan-gt-r-124.jpg,0,"63.99 RON","Maisto Nissan GT-R are carcasa metalica cu detalii din plastic. Este replicata scalata a modelului de masina original.",Noriel,Masinute
"Masinuta Maisto Lamborghini Murcielago 1:24",https://noriel.ro/media/catalog/product/cache/ed9f5ebe2a117625f6cd6336daddd764/m/a/masinuta-maisto-lamborghini-murcielago-124.jpg,0,"55.99 RON",,Noriel,Masinute
"Jucarie de plus Donald Duck, 25 cm",https://noriel.ro/media/catalog/product/cache/ed9f5ebe2a117625f6cd6336daddd764/j/u/jucarie-de-plus-donald-duck-25-cm.jpg,0,"52.99 RON","Camasa de marinar, berete, papion rosu, dar nu si pantaloni. Pe cine am descris acum? Pe Donald Duck, evident. Cu un temperament exploziv, Donald Duck este al treilea cel mai popular personaj pentru copii din toate timpurile si ii amuza la culme pe cei mici. Acum, cand vine sub forma de jucarie de plus, este ideal pentru cei din urma. Lumea arata altfel prin ochii lui.",Noriel,Plus
" Jucarie de plus Ursulet Chocolat, 44 cm",https://noriel.ro/media/catalog/product/cache/ed9f5ebe2a117625f6cd6336daddd764/j/u/jucarie-de-plus-ursulet-chocolat-44-cm.jpg,0,"59.99 RON","Primul prieten al copilului dumneavoastra este pufos, usor de imbratisat in timpul somnului si care ii face cunostinta acestuia cu lumea inconjuratoare, atat de vasta si de interesanta! Cu totii ne amintim de ursuletul de plus carpit, cu un nasture cusut de mama sau de bunica, dar care ne insotea in fiecare zi in noi aventuri si noi descoperiri. Iar la fel este si cel mic! Pentru ca lumea e mai frumoasa atunci cand cel mai bun prieten este o jucarie de plus.  Pufos si catifelat, copilul tau se va indragosti de imediat de Ursuletul Chocolat",Noriel,Plus
"Jucarie de plus Goofy, 25 cm",https://noriel.ro/media/catalog/product/cache/ed9f5ebe2a117625f6cd6336daddd764/j/u/jucarie-de-plus-goofy-25-cm_1_1.jpg,0,"41.99 RON","Salut, eu sunt Goofy! Pe langa Mickey Mouse si Donald Duck pot sa spun ca sunt unul din cele mai celebre personaje create de Disney si sunt intotdeauna dornic sa ajut!",Noriel,Plus
"Papusa LOL Surprise Ball - Pets, 7 piese (Seria 3-2B)",https://noriel.ro/media/catalog/product/cache/ed9f5ebe2a117625f6cd6336daddd764/p/a/papusa_lol_surprise_ball_-_pets_7_piese_seria_3-2b_3_111.jpg,0,"79.99 RON","LOL Pets Surprise sunt mici figurine cu forma de animalut, dragute, care isi dezvaluie functiile in sapte pasi!  Pentru a le gasi, desprindeti cate un alt strat al sferei, care mai tarziu poate deveni o intreaga colectie de accesorii pentru aceaste figurine dragute. Deschiderea fiecarui strat din cele sapte va ofera o placere incredibila. Este, de asemenea, o surpriza uriasa, deoarece nu stim la inceput ce figurina este ascunsa in minge - o vom stii in ultimul pas!  Colectioneaza-le pe toate cele 35 de mici surprize din aceasta noua gama a seriei a 3-a!",Noriel,Plus
"Papusa LOL Surprise Ball - Pets, 7 piese (Seria 3-2B)",https://noriel.ro/media/catalog/product/cache/ed9f5ebe2a117625f6cd6336daddd764/p/a/papusa_lol_surprise_ball_-_pets_7_piese_seria_3-2b_3_111.jpg,0,"79.99 RON","LOL Pets Surprise sunt mici figurine cu forma de animalut, dragute, care isi dezvaluie functiile in sapte pasi!  Pentru a le gasi, desprindeti cate un alt strat al sferei, care mai tarziu poate deveni o intreaga colectie de accesorii pentru aceaste figurine dragute. Deschiderea fiecarui strat din cele sapte va ofera o placere incredibila. Este, de asemenea, o surpriza uriasa, deoarece nu stim la inceput ce figurina este ascunsa in minge - o vom stii in ultimul pas!  Colectioneaza-le pe toate cele 35 de mici surprize din aceasta noua gama a seriei a 3-a!",Noriel,Papusi
"Papusa Colectia Lilia - Craiasa cu rochita albastra",https://noriel.ro/media/catalog/product/cache/ed9f5ebe2a117625f6cd6336daddd764/i/n/int5126_001_papusa_colectia_lilia_-_craiasa_cu_rochita_albastra.jpg,0,"49.99 RON","Lilia iti transforma lumea! Pentru ca nu este doar o papusa, ci eroina unei povesti. Ea vine de departe, dintr-o poveste straveche si fascinanta, plina de magie, de veselie si de incantare. Lumea in care tu si Lilia impartasiti un vis de printesa!  Traieste un vis de printesa! Magie, veselie si incantare!",Noriel,Papusi
"Papusa Barbie Skipper Babysitter Dayli",https://noriel.ro/media/catalog/product/cache/ed9f5ebe2a117625f6cd6336daddd764/p/a/papusa_barbie_skipper_babysitter_dayli_2.jpg,0,"79.99 RON","Papusa Skipper urmeaza pasii surorii ei mai mari Barbie si devine bona! Acum joaca este mai interesanta cu noile papusi de la Barbie Babysitter!",Noriel,Papusi
"Papusa Masha si tricicleta Simba",https://noriel.ro/media/catalog/product/cache/ed9f5ebe2a117625f6cd6336daddd764/p/a/papusa_masha_si_tricicleta_simba_109302059_2_.jpg,0,"59.99 RON","Papusa Masha este confectionata dintr-un cauciuc moale (fata si corpul), iar hainutele din plus. Simpatica papusa este inspirata din desenele animate ""Masha si Ursuletul"" si vine impreuna cu indragita ei tricicelta. Hai la plimbare cu micuta Masha!  Papusa dispune de articulatii flexibile.",Noriel,Papusi
"Papusa bebelus Maia Plange",https://noriel.ro/media/catalog/product/cache/ed9f5ebe2a117625f6cd6336daddd764/p/a/papusa_bebelus_maia_plange_int6789_2_.png,0,"149.99 RON","Papusa bebelus Maia Plange  Te intelegi de minune cu micuta Maia... pe limba ei! Chicoteste cand e vesela si plange ca un bebelus adevarat! Apasa pe burtica ei ca sa auzi sunete nostime si da-i apa cu biberonul ca s-o faci sa verse lacrimi: ochii ei sunt prevazuti cu orificii discrete prin care curge apa!  ",Noriel,Papusi
"Set figurina cu accesorii Minnie Disney, Fantasy Fairy W3",https://noriel.ro/media/catalog/product/cache/ed9f5ebe2a117625f6cd6336daddd764/1/8/185753_001w_set_figurina_cu_accesorii_minnie_disney_fantasy_fairy_w3_1_.jpg,0,"99.99 RON","Minnie este acum atat de fantastica si stralucitoare. Noile papusi Minnie cu accesorii sunt magice, cu noua varianta Minnie Zana.  Fiecare papusa este diferita si contine 2 rochii din material textil si o multime de accesorii, inclusiv fundite, coronite, pantofi, posete si multe altele special create pentru a-i completa tinuta magic de fantastica.   Toate papusile au acum extra sclipici pentru un aspect si mai stralucitor! Toate accesoriile sunt interschimbabile si se potrivesc cu toate papusile Minnie cu accesorii.  Descopera-le si colectioneaza-le pe toate!",Noriel,Papusi
"Bicicleta copii Spiderman 16 inch",https://noriel.ro/media/catalog/product/cache/ed9f5ebe2a117625f6cd6336daddd764/b/i/bicicleta-copii-spiderman-16-inch.jpg,0,"467.49 RON","Spiderman are superputeri. El se poate catara pe orice cladire, motiv pentru care este unul dintre eroii preferati ai celor mici, care ar vrea si ei sa fie ca el. In plus, are si un costum interesant, astfel ca nimeni nu ii stie reala identitate. Daca cel mic este fan Spiderman, atunci noi iti propunem ca el sa mearga alaturi de eroul lui preferat in parc. Cum? Cu bicicleta pentru copii Spiderman de la TOIMSA. Cu o inaltime de 40 de centimetri, cu roti ajutatoare detasabile, cu ghidon si scaun ajustabile, bicicleta pentru copii Spiderman de la TOIMSA este ideala pentru piticul dumneavoastra, care va merge in noi si noi aventuri alaturi de Spiderman.",Noriel,Outdoor
"Masinuta fara pedale Kiddieland - Mickey Mouse",https://noriel.ro/media/catalog/product/cache/ed9f5ebe2a117625f6cd6336daddd764/m/a/masinuta-fara-pedale-kiddieland-mickey-mouse_5.jpg,0,"185.09 RON","Masinuta actionata cu picioarele, colorata si decorata cu tema Disney - Mickey Mouse. Ai chiar si lumini de semnalizare, claxon si volan! Invarte cheia in contact, schimba vitezele si asculta sunetele turatiilor motorului.",Noriel,Outdoor
"Tobogan copii Dolu My First Slide",https://noriel.ro/media/catalog/product/cache/ed9f5ebe2a117625f6cd6336daddd764/t/o/tobogan-copii-dolu-my-first-slide_2.jpg,0,"99.99 RON","      Toboganul poate fi folosit atat in interior, cat si in exterior.     Poate fi pliat si depozitat cu usurinta sub pat sau sub alt corp de mobilier.     Produsul dispune de o stabilitate superioara.     A se folosi sub stricta supraveghere a parintilor sau a unui adult.",Noriel,Outdoor
"Role copii Inline STAMP Minnie Mouse, Marime 30-33",https://noriel.ro/media/catalog/product/cache/ed9f5ebe2a117625f6cd6336daddd764/r/o/role-copii-inline-stamp-minnie-mouse-marime-30-33_4.jpg,0,"179.99 RON","Sa inceapa distractia pe roti!  Rolele Minnie Mouse reglabile intre marimile 30 - 33 sunt ideale pentru plimbari in parc!",Noriel,Outdoor
"Masinuta cu pedale Dolu, ATV, Albastru",https://noriel.ro/media/catalog/product/cache/ed9f5ebe2a117625f6cd6336daddd764/d/o/dolu8065_001w_masinuta_cu_pedale_dolu_atv_off_road_albastru_1_.jpg,0,"299.99 RON",,Noriel,Outdoor
" Masinuta fara pedale Kiddieland - Primul meu avion Mickey ",https://noriel.ro/media/catalog/product/cache/ed9f5ebe2a117625f6cd6336daddd764/m/a/masinuta-fara-pedale-kiddieland-primul-meu-avion-mickey-mouse.jpg,0,"247.99 RON","Calatoreste in inaltul cerulului cu primul tau avion Mickey Mouse! Primeste comenzile de zbor pe frecventa radio si asculta sunetul motorului! Elicea se invarte si formeaza linii de lumina viu colorate.",Noriel,Outdoor
"Joc Cyberpunk 2077 pentru PC ",https://s12emagst.akamaized.net/products/19334/19333536/images/res_275585029c59e0e35aa61024b6a6452a_450x450_c77u.jpg,0,"299.99 RON",,Noriel,"Jocuri Video"
"Joc Grand Theft Auto V pentru PC ",https://s12emagst.akamaized.net/products/51/50296/images/res_9d7a13e572d31e6c87ace975d37ccbe9_450x450_5169.jpg,0,"128.52 RON",,Emag,"Jocuri Video"
"Joc Forza Horizon 4 (Download Code) Windows 10 si Xbox One",https://s12emagst.akamaized.net/products/18205/18204893/images/res_dbd1aede622275cfa9111cfe93370547_450x450_t578.jpg,0,"247 RON","Pentru prima data in jocurile de curse, experimentati sezoanele dinamice intr-o lume open world. Explorati peisaje frumoase, colecteaza peste 450 de masini si deveniti un Superstar Horizon in istoricul Marii Britanii.   Bucurate de cea mai mare si mai diversa lista de masini Horizon, inclusiv peste 100 de producatori autorizati.  In aceasta noua campanie open-world fiecare efort pe care il vei depune va conta la progresul tau final.  Jucatorii reali vor popula lumea Horizon. Vremea si anotimpurile se vor schimba, iar toata lumea care joaca acest joc experimenteaza in acelasi timp aceste schimbari.  Aceasta este Marea Britanie, asa cum nu ati mai vazut niciodata. Descoperiti lacuri, vai, castele si peisaje minunate, toate in 4K si HDR nativ pe Xbox One X.",Emag,"Jocuri Video"
"Need for Speed Payback, pentru PC ",https://s12emagst.akamaized.net/products/8145/8144107/images/res_0ed4cb9fffc5d35539c9cb188299a12a_450x450_f33.jpg,0,"247 RON",,Emag,"Jocuri Video"
"Joc FAR CRY PRIMAL pentru PC ",https://s12emagst.akamaized.net/products/2755/2754388/images/res_a5c0e59c2b7398d9fa825b548c51c565_450x450_lnke.jpg,0,"55.34 RON",,Emag,"Jocuri Video"
"Joc DOOM ETERNAL pentru PC ",https://s12emagst.akamaized.net/products/15689/15688480/images/res_f6a0726318295016ad455d5d0454d7a7_450x450_a3uo.jpg,0,"259.99 RON",,Emag,"Jocuri Video"
"Microfon karaoke cu stativ Magie&Bianca Smoby ",https://static-02.mackoviahracky.sk/files/image_bank/520116-a-smoby-karaoke.jpg,0,"250 RON","V-ați dori să-i oferiți ca și cadou copilașului dumneavoastră un karaoke cu microfon? Microfonul static karaoke de jucărie Magie&Bianca Smoby cu funcții sonore și luminoase este potrivit pentru fiecare fetiță de la vârsta de 5 ani, care îmbracă cu plăcere rolul de divă mică. Microfonul minunat Magie&Bianca, care strălucește în culoare roz conține și un suport și un modul electronic, pe care se poate așeza microfonul și se poate conecta la acesta. Înălțimea microfonului karaoke cu suport este de 120 cm. Microfonul karaoke conectat la modulul electronic îi va fi de ajutor fetiței dumneavoastră la reglarea volumului sau pentru alegerea altor efecte sonore. ",JucariiTeddies,Muzical
"Chitară Dohány",https://media.mackoviahracky.sk/files/image_bank/1838.jpg,0,"30 RON","Chitara electronică Dohany de la producătorul franţuzesc Smoby este o jucărie perfectă pentru orice muzician mic, care îşi doreşte să înveţe să cânte la chitară sau să-şi perfecţioneze cunoştinţele pe instrumentul muzical. Mărimea chitarei este: 42*13*5 cm. Chitara este un instrument muzical perfect pentru copii cu vârstele  de 4-5 ani. Aceasta s-a fabricat din materiale rezistente şi de calitate și oferă  copiilor siguranță în timpul jocului. Chitara pentru copii este un produs European, care corespunde standardelor de siguranţă şi de calitate.",JucariiTeddies,Muzical
"Tobe Dohány ",https://static-01.mackoviahracky.sk/files/image_bank/1840.jpg,0,"30 RON","Tobele Dohany, pentru copii sunt un instrument perfect pentru orice muzician mic, căruia i-ar place să înveţe să cânte la un instrument muzical. Jucăria are culoarea albastră combinat cu culoarea verde,care o face mult mai veselă,jucăuşă şi fresh.  Aceasta s-a fabricat din materiale de calitate şi rezistente care corespunde standardelor de siguranţă şi calitate europeană.Cu siguranţă copii vor trăi numeroase momente distractive cu ajutorul tobelor de la producătorul unguresc, Dohany.",JucariiTeddies,Muzical
"Pian Maggie&Bianca Smoby ",https://static-01.mackoviahracky.sk/files/image_bank/1840.jpg,0,"300 RON","Lăsați-vă copii să-și dezvolte urechea muzicală. Oferiți-le un pian frumos electronic Smoby. Pianul electronic Maggie&Bianca cu 49 de clape de la producătorul franțuzesc Smoby le oferă tuturor fetițelor de la vârsta de 5 ani o experiență muzicală cu adevărat extraordinară îmbogățită cu efecte luminoase. Pianul electronic pentru copii este fabricat într-o combinație minunată de roz-alb cu licența trupei populare italiene Maggie&Bianca. Pianul pentru copii oferă de asemenea opțiunea de a conecta un audio player datorită mufei plug in de 3,5 mm. Cablul nu este inclus. ",JucariiTeddies,Muzical
"Microfon Maggie&Bianca Smoby",https://media.mackoviahracky.sk/files/image_bank/520115-a-smoby-mikrofon.jpg,0,"100 RON","Căutați un microfon pentru copilașul dumneavoastră cu, care poate să cânte ? Microfonul pentru copii Maggie&Bianca Smoby este un cadou frumos pentru toate fetele de la vârsta de 5 ani, cărora le place să cânte. Microfonul este fabricat într-o combinație de culori frumoase  cu un design modern și cu motivul grupului popular Maggie&Bianca. Fetele se vor îndrăgosti de microfonul cu funcții sonore și luminoase și posibilitatea de a conecta rapid la un telefon mobil. Microfonul le va preocupa pe fetițe pentru un timp îndelungat. Microfonul pentru copii are diferite efecte sonore și funcții luminoase, care se aprind în ritmul muzicii. Microfonul are înregistrat 4 piese și 4 efecte, inclusiv sunetul de aplauze, pe care fetița o poate alege după spectacolul ei. ",JucariiTeddies,Muzical
"Chitară mare Dohány",https://static-03.mackoviahracky.sk/files/image_bank/1839.jpg,0,"50 RON","Chitara electronică Dohany de la producătorul franţuzesc Smoby este o jucărie perfectă pentru orice muzician mic, care îşi doreşte să înveţe să cânte la chitară sau să-şi perfecţioneze cunoştinţele pe instrumentul muzical.Mărimea chitarei este: 67*23*5 cm. Chitara este un instrument muzical perfect pentru copii cu vârstele  de 5-6 ani. Aceasta s-a fabricat din materiale rezistente şi de calitate și oferă  copiilor siguranță în timpul jocului. Chitara pentru copii este un produs European, care corespunde standardelor de siguranţă şi de calitate.",JucariiTeddies,Muzical
